{
  "$defs": {
    "action": {
      "enum": [
        "STOP",
        "MOVE_FORWARD",
        "TURN_LEFT",
        "TURN_RIGHT",
        "LOOK_UP",
        "LOOK_DOWN"
      ]
    },
    "episode_id": {
      "pattern": "^[0-9]+$",
      "type": "string"
    },
    "eval_set": {
      "description": "names = keys of data/val_unseen_splits.json (smoke 60, quick 306, dev 1,413, lockbox 426) + C10 fixtures (g60, ha-mini)",
      "pattern": "^(smoke|quick|dev|lockbox|val_unseen|val_seen|trainho|g60|ha-mini|test|syn-[a-z0-9-]+)(@v[0-9]+)?$",
      "type": "string"
    },
    "input_kind": {
      "enum": [
        "rgb",
        "depth",
        "pose",
        "instruction",
        "episode_id",
        "start_pose",
        "siblings",
        "navmesh",
        "humans_gt",
        "goal_gt",
        "scene_mesh",
        "test_scan_assets",
        "collision_flag"
      ]
    },
    "mode": {
      "enum": [
        "compliant",
        "privileged"
      ]
    },
    "prob": {
      "maximum": 1,
      "minimum": 0,
      "type": "number"
    },
    "quat_xyzw": {
      "items": {
        "type": "number"
      },
      "maxItems": 4,
      "minItems": 4,
      "type": "array"
    },
    "regime": {
      "description": "C1 R0 wall=official wall-clock; R1 wallx:<s/step> throttled; R2 frz:<k> frozen at frame k; R3 sps:<S> deterministic schedule at S steps/s (C6 virtual clock dhat=5 ms == sps:200); R4 allf = all-frames kinematic certificate; C6 extras: lock (step-locked), stall:<k>, rand:<seed> (random monotone schedule); static = no humans",
      "pattern": "^(wall|wallx:[0-9.]+|frz:([0-9]|[1-9][0-9]|1[01][0-9])|sps:[0-9]+|allf|lock|stall:([0-9]|[1-9][0-9]|1[01][0-9])|rand:[0-9]+|static)$",
      "type": "string"
    },
    "sha256": {
      "pattern": "^[0-9a-f]{64}$",
      "type": "string"
    },
    "split": {
      "enum": [
        "train",
        "val_seen",
        "val_unseen",
        "test",
        "synthetic"
      ]
    },
    "task_id": {
      "pattern": "^(W[0-8]|INT|REV|OPS)-T[0-9]{2,3}$",
      "type": "string"
    },
    "utc": {
      "pattern": "^20[0-9]{2}-[01][0-9]-[0-3][0-9]T[0-2][0-9]:[0-5][0-9](:[0-5][0-9](\\.[0-9]+)?)?Z$",
      "type": "string"
    },
    "vec3": {
      "items": {
        "type": "number"
      },
      "maxItems": 3,
      "minItems": 3,
      "type": "array"
    }
  },
  "$id": "havln-team/contracts/PlanRequest/1",
  "$schema": "https://json-schema.org/draft/2020-12/schema",
  "additionalProperties": false,
  "properties": {
    "contract": {
      "const": "PlanRequest/1"
    },
    "frames": {
      "anyOf": [
        {
          "const": "all"
        },
        {
          "items": {
            "maximum": 119,
            "minimum": 0,
            "type": "integer"
          },
          "type": "array"
        }
      ]
    },
    "goal_radius_m": {
      "maximum": 3.0,
      "minimum": 0,
      "type": "number"
    },
    "goal_samples_world": {
      "items": {
        "$ref": "#/$defs/vec3"
      },
      "type": "array"
    },
    "goal_world": {
      "$ref": "#/$defs/vec3"
    },
    "human_margin_m": {
      "minimum": 0,
      "type": "number"
    },
    "inflate_m": {
      "maximum": 0.6,
      "minimum": 0,
      "type": "number"
    },
    "max_actions": {
      "maximum": 500,
      "minimum": 1,
      "type": "integer"
    },
    "mode": {
      "const": "privileged"
    },
    "purpose": {
      "enum": [
        "teacher",
        "trackB",
        "oracle_eval"
      ]
    },
    "scan": {
      "type": "string"
    },
    "start": {
      "properties": {
        "position_world": {
          "$ref": "#/$defs/vec3"
        },
        "rotation_world_xyzw": {
          "$ref": "#/$defs/quat_xyzw"
        }
      },
      "required": [
        "position_world",
        "rotation_world_xyzw"
      ],
      "type": "object"
    },
    "stop_target": {
      "enum": [
        "goal",
        "max_p_within_3m"
      ]
    },
    "token": {
      "type": "string"
    },
    "waypoint_hints": {
      "items": {
        "properties": {
          "position_world": {
            "$ref": "#/$defs/vec3"
          },
          "radius_m": {
            "type": "number"
          }
        },
        "required": [
          "position_world"
        ],
        "type": "object"
      },
      "type": "array"
    }
  },
  "required": [
    "contract",
    "mode",
    "token",
    "scan",
    "start",
    "goal_world",
    "goal_radius_m",
    "inflate_m",
    "human_margin_m",
    "frames",
    "max_actions",
    "purpose"
  ],
  "title": "PlanRequest/1 (PRIVILEGED, oracle/ only): the Track-B 'goal point + optional waypoint hints -> actions' contract, also used by the DAgger/RL teacher (purpose=teacher) and oracle-goal evaluations. Served by W1 planning service; token-gated.",
  "type": "object"
}