{
  "contract": "PlanRequest/1",
  "frames": "all",
  "goal_radius_m": 0.2,
  "goal_world": [
    4.0,
    0.07,
    -6.2
  ],
  "human_margin_m": 0.5,
  "inflate_m": 0.25,
  "max_actions": 480,
  "mode": "privileged",
  "purpose": "teacher",
  "scan": "zsNo4HB9uLZ",
  "start": {
    "position_world": [
      -1.2,
      0.07,
      3.4
    ],
    "rotation_world_xyzw": [
      0,
      0.7071,
      0,
      0.7071
    ]
  },
  "stop_target": "goal",
  "token": "tok-oracle-W7",
  "waypoint_hints": []
}